1,"versus Senior Inspector of Police and another Applicant Respondents WITH CRIMINAL BAIL APPLICATION NO.1510 OF 2018 Genusing Somlunayak Chauhan, Age 33 years, R/o.Post Kanyakolur, Japa Nayak Tanda, Tal.Sahapur, District Yadgir, Karnataka State.",3
2,"versus The State of Maharashtra Applicant Respondent WITH CRIMINAL BAIL APPLICATION NO.1924 OF 2018 Kiran Srinivas Chavan, Age 30 years, R/o.House No.4-140, Vijay Laxmi Street, Humnabad, Dist.Bidar, Karnataka.",3
3,versus The State of Maharashtra Respondent Respondent Mr.Balwant Salunkhe for applicant in BA No.3352/2018.,1
4,Mr.Santosh M. Deshpande for applicant in BA No.1510/2018.,0
5,Mr.Aabad Ponda No.1924/2018.,0
6,"I/by Karma Vivan for applicant in BA Mr.Prashant Jadhav, APP, for State.",1
7,"CORAM : PRAKASH D. NAIK, J.",0
8,"DATE : 14th February 2019 Indian Kanoon - http://indiankanoon.org/doc/168954367/ 1 Genusing Somlunayak Chauhan vs The State Of Maharashtra on 14 February, 2019 2 of 6 904.BA.3352.2018.doc PC : 1\.",6
9,"The applicants in all these applications are seeking bail under Section 439 of Code of Criminal Procedure, 1973 in connection with CR No.I-07 of 2017 registered with Kongaon Police Station for offences under Sections 395, 365, 201, 120B, 411, 412 of Indian Penal Code r/w Sections 3(I),(II), 3(2), 3(4) of Maharashtra Control of Organized Crime Act (`MCOC Act').",8
10,The applicant in Bail Application No.3352 of 2018 was arrested on 13th February 2017.,5
11,"The applicant in Bail Application No.1510 of 2018 was arrested on 8th March 2017, whereas applicant in Bail Application No.1924 of 2018 is arrested on 8th March 2017.",5
12,2\.,0
13,"The prosecution case is that the complainant is resident of Kalyan, District Thane.",1
14,He is employee of company viz Proconnect Supply Solutions Limited as Assistant General Manager.,0
15,"The said company is having its godown at Gala Nos.1 to 10, Building No.E/6, behind Cipla Company, Pimpalas Road, Pimplas Gaon, Tal.Bhiwandi wherein electronic goods of various companies are stored.",1
16,About 50 persons are working in the said godown.,0
17,Several security guards are deputed for security in the said godown.,0
18,On 10-1-2017 the complainant received telephonic call from the security guard informing him that theft has taken place in the godown of the company.,0
19,The complainant immediately rushed to the spot.,0
20,"On reaching the godown it was revealed that shutter no.11 of the godown was broken and the accused had committed theft of mobile phones, I-Pods, Chargers and USB cables valued at Rs.42,19,490/-.",0
21,The complainant thereafter lodged complaint in respect of said theft with Kongaon Police Station against unknown persons.,0
22,The offence 3 of 6 904.BA.3352.2018.doc as stated hereinabove was registered.,1
23,The spot panchanama was recorded.,0
24,Subsequently the accused were arrested.,0
25,Approval was sought for application of provisions of MCOC Act in accordance with Section 23(1) of the said Act.,5
26,Sanction was accorded for application of provisions of MCOC Act.,2
27,The applicants were remanded to custody from time to time.,0
28,On completing investigation charge sheet has been filed.,1
29,3\.,0
30,Learned counsel representing the accused submitted that the provisions of MCOC Act are not attracted in the present case.,3
31,There is no evidence to show that the applicant were the members of organized crime syndicate.,1
32,The prosecution is relying upon the confession of one of the accused Santosh Chavan recorded u/s 18 of MCOC Act.,1
33,It is a weak piece of evidence and requires corroboration.,0
34,"Considering the nature of evidence against applicants, embargo enunciated u/s 21(4) of MCOC Act is not attracted against applicants.",1
35,4\.,0
36,Learned counsel for applicants in respective applications submitted that there is no cogent evidence against applicants.,1
37,The provisions of MCOC Act are not applicable against them.,2
38,"The coIndian Kanoon - http://indiankanoon.org/doc/168954367/ 2 Genusing Somlunayak Chauhan vs The State Of Maharashtra on 14 February, 2019 accused Laxman Chavan, Sanjaykumar @ Munna Babu Bula were granted bail in Bail Application Nos.571 of 2018 and 945 of 2018.",9
39,5\.,0
40,Learned counsel for applicant in BA No.3352 of 2018 submitted that there is no evidence to establish his link with the crime syndicate.,4
41,There are no antecedents against him.,0
42,The prosecution is relying on the confession of the co-accused which is not corroborated by any evidence.,0
43,It is further submitted that there is no identification parade identifying the applicant as the person 4 of 6 904.BA.3352.2018.doc who is involved in the crime.,0
44,"Except recovery of three mobile phones at the instance of applicant, there is no evidence to show his complicity in the crime.",1
45,The advocate for applicant in Bail Application No.1510 of 2018 submitted that there is no evidence of identification parade against him and there is no recovery of any nature against him.,2
46,Even there is no CDR record to show his involvement in the crime.,0
47,There is no evidence of his participation in the crime and the prosecution is merely relying on the confessional statement of co-accused Santosh Chavan.,0
48,"Whereas, advocate for applicant in Bail Application No.1924 of 2018 submitted that there is lack of evidence to establish his connection with organized crime syndicate.",3
49,It is submitted that at the most the involvement of applicant can be attributed to the charge of receiver of stolen property.,0
50,The prosecution has not been able to show that the applicant is member of organized crime syndicate to invoke the provisions of MCOC Act.,2
51,It is submitted that the applicant is arrested on the basis of statement of Kishor Budhwant.,3
52,It is submitted that confessional statement of Santosh Chavan in fact exonerates the applicant from being involved in the crime.,1
53,The case of prosecution with reference to exchange of cash amount towards sale of mobile phones cannot be accepted because the alleged act had occurred during the period of demonetization and it would not have been possible to arrange cash as indicated in the statement of witnesses.,4
54,It is further submitted that the evidence of witnesses relied upon by prosecution suffers from various infirmities in the nature of contradiction and it is difficult to accept the said evidence.,0
55,It is submitted that there is no parade to corroborate the involvement of applicant in the crime.,0
56,He is in custody from the date of arrest.,0
57,5 of 6 904.BA.3352.2018.doc 6\.,0
58,Learned APP on the contrary submitted that there is evidence to show involvement of applicants in crime.,1
59,It is submitted that the prosecution is relying on the confessional statement of co- accused Santosh Chavan recorded u/s 18 of MCOC Act.,1
60,It is submitted that the said accused has shown involvement of accused in the crime.,1
61,It is further submitted that applicant in Bail Application No.3352 of 2018 was instrumental in bringing the tempo.,2
62,It is submitted that in the confessional statement of the co-accused it is indicated that the applicant in Bail Application No.3352 of 2018 had brought tempo which was used in commission of crime.,3
63,It is further submitted that one another case is registered against applicants in Bail Application No.1510 of 2018 and 1924 of 2018.,7
64,"However, learned counsel representing applicants submitted that in the said case, the applicants were arrested after the arrest was shown in present case.",1
65,The said case was registered against unknown persons and the applicants are released on bail.,1
66,"As observed hereinabove, as far as applicant in Bail Application No.3352 of 2018 is concerned, there is no identification parade.",3
67,"Except recovery of three mobile phones, there is no other evidence against him.",0
68,"Similarly as far as applicant in Bail Application No.1510 of 2018 is concerned, except confessional statement recorded u/s 18 of MCOC Act of co-accused, there is no evidence against the applicant.",3
69,His role in the crime is not established.,0
70,"Indian Kanoon - http://indiankanoon.org/doc/168954367/ 3 Genusing Somlunayak Chauhan vs The State Of Maharashtra on 14 February, 2019 As far as applicant in Bail Application No.1920 of 2018 is concerned, the prosecution has relied upon recovery of 11 mobile phones.",7
71,"However, as stated above, there are discrepancies in the evidence of witnesses relied upon by prosecution.",1
72,There is nothing on record to link the applicant as the person who is the member of organized crime syndicate.,0
73,There are no other cases against him except the case in which he was arrested after he is 6 of 6 904.BA.3352.2018.doc shown arrested in the present case to show that he was involved in the activities of organized crime syndicate.,1
74,The confessional statement of the co-accused also does not show any corroborative circumstance against the said applicant as person who is involved in any crime.,0
75,The applicants are in custody from the date of arrest.,0
76,Investigation is completed and charge sheet is filed.,1
77,7\.,0
78,"Considering the facts and circumstances of the case and nature of evidence against the applicants in these applications, the rigors of Section 21(4) of MCOC Act would not be attracted in present cases.",4
79,"Hence, case for grant of bail is made out.",1
80,"Hence, I pass following order : ORDER (i) Criminal Bail Application No.3352 of 2018, Criminal Bail Application No.1510 of 2018 and Criminal Bail Application No.1924 of 2018 are allowed and disposed off; (ii) The applicants in these Criminal Bail Applications be released on bail in connection with CR No.I-07 of 2017 registered with Kongaon Police Station, on their furnishing PR bond in the sum of Rs.25,000/- each with one or more sureties in the like amount; (iii) The applicants in these Bail Applications are directed to report Kongaon Police Station once in a month on every first Saturday between 10 am and 12 noon till conclusion of trial; (iv) The applicants in these Bail Applications shall attend the Trial Court regularly on dates of hearing of the case, unless exempted by the said Court for some reason.",7
81,"(PRAKASH D. NAIK, J.)",0
82,MST Indian Kanoon - http://indiankanoon.org/doc/168954367/ 4,0
