1,Lrs.,0365,The first Indian Kanoon - http://indiankanoon.org/doc/58175470/ 14 Jagdish Prasad Patel(D) Thr.,0
366,Lrs.,0
367,"vs Shivnath on 9 April, 2019 Appellate Court, in our view, was not right in doubting the correctness of Ex.",4
368,D-20 and not right in observing that defendant No.1 is not having a legal right of ownership on the disputed lands.,0
369,The first appellate court and the High Court fell in error in not taking into consideration Ex.D-1-order of the Commissioner dated 17.07.1973 and the order of the Tahsildar dated 28.07.1971 and other documents showing grant of lease/patta in the name of Gaya Din and the continued possession of Gaya Din and his son- Hanuman Din and the appellants.,1
370,The first Appellate Court and the High Court erred in brushing aside the findings recorded by the Commissioner dated 17.07.1973 as to the misconduct of the patwari in making entries in the revenue records.,2
371,41\.,0
372,"In the suit for declaration for title and possession, the plaintiffs-respondents could succeed only on the strength of their own title and not on the weakness of the case of the defendants- appellants.",2
373,The burden is on the plaintiffs-respondents to establish their title to the suit properties to show that they are entitled for a decree for declaration.,3
374,The plaintiffs-respondents have neither produced the title document i.e.,1
375,patta- lease which the plaintiffs-respondents are relying upon nor proved their right by adducing any other evidence.,1
376,"As noted above, the revenue entries relied on by them are also held to be not genuine.",0
377,"In any event, revenue entries for few Khataunis are not proof of title; but are mere statements for revenue purpose.",0
378,They cannot confer any right or title on the party relying on them for proving their title.,0
379,"Observing that in a suit for declaration of title, the plaintiffsrespondents are to succeed only on the strength of their own title irrespective of whether the defendants-appellants have proved their case or not, in Union of India and others v. Vasavi Cooperative Housing Society Limited and others (2014) 2 SCC 269, it was held as under:15.",4
380,"It is trite law that, in a suit for declaration of title, the burden always lies on the plaintiff to make out and establish a clear case for granting such a declaration and the weakness, if any, of the case set up by the defendants would not be a ground to grant relief to the plaintiff.",4
381,42\.,0
382,"Upon appreciation of evidence, the trial court has recorded findings on various issues which was reversed by the first Appellate Court.",2
383,"Since the first Appellate Court reversed the judgment of the trial court, in the second appeal, the High Court ought to have weighed and considered the evidence and materials.",3
384,"The order of the High Court dismissing the appellants appeal by affirming the findings of the first Appellate Court is mainly on the ground that in the absence of any order of abandonment or revocation of the patta granted to the respondents- plaintiffs, grant of patta (Ex.D-20) in favour of the appellants-defendants was illegal.",3
385,"The High Court, in our view, did not appreciate the patta (Ex.D-20) granted in favour of the forefathers of the appellants by the competent authority in 1929 and the report of the Revenue Inspector dated 05.10.1969.",3
386,"The first Appellate Court and the High Court did not consider Ex.D-1- Order of the Commissioner dated 17.07.1973 and the report of the SDO dated 21.10.1969 and other revenue records showing that the forefather of the appellants-defendants namely Gaya Din was given the patta (Ex.D-20) and since then, Gaya Din and Hanuman Din were in possession of the properties.",1
387,The High Court has not properly appreciated the evidence and materials on record and the impugned judgment is liable to be set aside.,3
388,43\.,0
389,"In the result, the judgment of the High Court in the Second Appeal No.174 of 1989 dated 05.02.2007 is set aside and this appeal is allowed.",10
390,The Suit No.68-A/75 filed by the respondentsIndian Kanoon - http://indiankanoon.org/doc/58175470/ 15 Jagdish Prasad Patel(D) Thr.,1
391,Lrs.,0
392,"vs Shivnath on 9 April, 2019 plaintiffs is dismissed and the judgment of the trial court shall stand restored.",7
393,No order as to cost.,0
394,......J.,0
395,[R. BANUMATHI] ...J.,0
396,"[R. SUBHASH REDDY] New Delhi; April 09, 2019.",3
397,Indian Kanoon - http://indiankanoon.org/doc/58175470/ 16,0
