1,Lrs.,0188,"In the absence of the contra evidence adduced by the respondents- plaintiffs, the trial court rightly held that the appellants have been in continuous possession of the suit properties and that the respondents have failed to prove their right over the suit properties prior to filing of the suit.",3
189,25\.,0
190,Ex.,0
191,"D-1 Order of the Commissioner dated 17.07.1973:- In the proceeding initiated by the appellants father Hanuman Din, an application was filed before the District Collector alleging interpolation by patwari in the gashti khasras at the behest of the plaintiffs-respondentsVishwanath, Shiv Nath and Jairaj Kumari in respect of khasra Nos.",3
192,"131,151,161,162,163 and 411.",0
193,The order of the Commissioner refers to the order passed by Tahsildar dated 28.07.1971 upholding the entries in favour of appellants father Hanuman Din and rejecting the plaintiffs- respondents claim.,3
194,"After personally perusing the relevant khasras, the Tahsildar held that entries for the years 1963-64 to 1968-69 made in favour of plaintiffs-respondents were subsequently made and Tahsildar directed correction of khasra entries in favour of appellants father.",1
195,"In revision, the Collector upheld the said order of the Tahsildar dated 28.07.1971.",1
196,26\.,0
197,"In revision against the order of the Collector, the Commissioner vide order dated 17.07.1973 upheld the order of Tahsildar observing that from perusal of SDOs report dated 21.10.1969 and the Indian Kanoon - http://indiankanoon.org/doc/58175470/ 7 Jagdish Prasad Patel(D) Thr.",1
198,Lrs.,0
199,"vs Shivnath on 9 April, 2019 order of Tahsildar dated 28.07.1971, the mischief of patwari was proved beyond shadow of doubt.",5
200,These orders were not challenged by the plaintiffs-respondents and are binding on them.,1
201,"The relevant portion of the order of the Commissioner reads as under:In the Court of Shri Jagat Swarup, Commissioner Rewa Divn.",1
202,"Rewa, M.P.",0
203,Case No.52/A.61/71-73: Dated 17.07.1973 .,2
204,2\.,0
205,A perusal of the records of the lower courts reveals that N.A.,0
206,"Hanuman filed an application dated 19.09.1969 before Collector Sidhi alleging interpolation by Patwari in the Gashti- Khasaras in respect of Khasra Nos.131, 151, 161, 162, 163 and 41 of Village Bairath, Tehsil Gopadbanas.",3
207,The application was sent to SDO for enquiry.,0
208,SDO reported vide his report dated 21.10.1969 that the allegations are true and the patwari was guilty of grave misconduct.,1
209,The charge of interpolation is amply proved.,0
210,"Collector also found the report to be true, but ordered that Tehsildar should hear the opposite party before ordering correction (Order Sheet dated 23.10.1969).",1
211,Tehsildar held the enquiry and on the basis of documents and oral evidence ordered correction of khasra entries for the year 1963-64 to 1968-69 vide his order dated 28.07.1971.,4
212,The perusal of SDOs report dated 21.10.1969 and the order of Tehsildar dated 28.07.1971 reveals that the mischief of patwari was proved beyond a shadow of doubt.,1
213,The order passed by the Tehsildar has to be treated as administrative in nature and cannot be set aside u/s 50 of the M.P.,3
214,"Land Revenue Code, 1959.",2
215,3\.,0
216,So far as the present proceedings u/s 50 of the M.P.,0
217,"Land Revenue Code, 1959 are concerned, they do not lie.",2
218,"Administratively, I uphold the order dated 28.07.1971 passed by the Tehsildar, because it is based on unassailable logic.",2
219,"After all, patwari cannot be the final arbiter of the destinies of cultivators.",0
220,"From the above order of the Commissioner and the report of the other revenue authorities, it is clear that the plaintiffs- respondents have made interpolation in the revenue entries in connivance with Patwari and got the revenue entries recorded in their names.",1
221,The High Court and the first Appellate Court erred in not considering Ex.D-1-order of the Commissioner in its proper perspective.,0
222,27\.,0
223,"Application filed for receiving additional evidence:- The question may arise that though the number of orders were passed in various proceedings before the Revenue Authorities, why the respondents-plaintiffs have not challenged the same then and there.",4
224,The real fact is that the respondents-plaintiffs did challenge various orders passed by the revenue authorities before the concerned authorities and lost.,2
225,"Unfortunately, those documents have not been filed by the appellants- defendants in the courts below.",2
226,"Before this Court, the appellants-defendants have filed an application to receive three additional documents which are the orders passed by the Naib Indian Kanoon - http://indiankanoon.org/doc/58175470/ 8 Jagdish Prasad Patel(D) Thr.",4
227,Lrs.,0
228,"vs Shivnath on 9 April, 2019 Tahsildar dated 01.09.1962, order of Tahsildar dated 28.07.1971 and order of Collector dated 21.11.1972.",5
229,The three documents which according to the appellants are relevant are:S.No.,0
230,1\.,0
231,"01.09.1962 Documents Order passed by the Naib Remarks Application was Tahsildar, Gopad Banas in the suit fileddismissed holding that the by Shivnath, son of Ram Sahai and patta of the land was Shivnath, son of Rameshwar under issued by the Tahsildar in Section 250 of M.P.",3
232,"Land Revenue favour of Gayadin father Code, 1959. of the appellantdefendant.",2
233,2\.,0
234,3\.,0
235,"28.07.1971 Order of Tahsildar, Gopad Banas in Civil Suit No.26 A74/70-71 in the suit filed by Hanuman son of Gayadin 21.11.1972 Order of the Collector, District Siddi \- \- The learned senior counsel for the respondents submitted that there is a clear bar to adduce additional evidence in the appellate court subject to circumstances stated under Order XLI Rule 27 CPC and no such circumstance has been set-forth in the application filed by the appellants.",5
236,It was submitted that there was no pleading to that effect in the written statement and if the application to receive additional evidence is allowed then it would amount to de novo trial of the suit which was filed nearly after forty-nine years.,4
237,"It was further submitted that when these documents were neither filed in the trial court nor before the first appellate court nor before the High Court, the Supreme Court cannot entertain the documents filed as additional evidence.",4
238,"In support of his contention, the learned senior counsel relied upon Karewwa and others v. Hussensab Khansaheb Wajantri and others (2002) 10 SCC 315 and Roop Chand v. Gopi Chand Thelia (1989) 2 SCC 383 and other decisions.",1
239,28\.,0
240,"Under Order XLI Rule 27 CPC, production of additional evidence, whether oral or documentary, is permitted only under three circumstances which are: (I) Where the trial Court had refused to admit the evidence though it ought to have been admitted; (II) the evidence was not available to the party despite exercise of due diligence; and (III) the appellate Court required the additional evidence so as to enable it to pronounce judgment or for any other substantial cause of like nature.",1
241,An application for production of additional evidence cannot be allowed if the appellant was not diligent in producing the relevant documents in the lower court.,2
242,"However, in the interest of justice and when satisfactory reasons are given, court can receive additional documents.",0
243,29\.,0
244,"In Union of India v. Ibrahim Uddin & Another, (2012) 8 SCC 148, this Court held as under:Indian Kanoon - http://indiankanoon.org/doc/58175470/ 9 Jagdish Prasad Patel(D) Thr.",4
245,Lrs.,0
246,"vs Shivnath on 9 April, 2019 36\.",4
247,The general principle is that the appellate court should not travel outside the record of the lower court and cannot take any evidence in appeal.,1
248,"However, as an exception, Order 41 Rule 27 CPC enables the appellate court to take additional evidence in exceptional circumstances.",0
249,The appellate court may permit additional evidence only and only if the conditions laid down in this Rule are found to exist.,2
250,"The parties are not entitled, as of right, to the admission of such evidence.",0
251,"Thus, the provision does not apply, when on the basis of the evidence on record, the appellate court can pronounce a satisfactory judgment.",4
252,The matter is entirely within the discretion of the court and is to be used sparingly.,0
253,Such a discretion is only a judicial discretion circumscribed by the limitation specified in the Rule itself.,0
254,"(Vide K. Venkataramiah v. A. Seetharama Reddy AIR 1963 SC 1526, Municipal Corpn.",3
255,"of Greater Bombay v. Lala Pancham AIR 1965 SC 1008, Soonda Ram v. Rameshwarlal (1975) 3 SCC 698 and Syed Abdul Khader v. Rami Reddy (1979) 2 SCC 601.)",3
256,37\.,0
257,The appellate court should not ordinarily allow new evidence to be adduced in order to enable a party to raise a new point in appeal.,4
258,"Similarly, where a party on whom the onus of proving a certain point lies fails to discharge the onus, he is not entitled to a fresh opportunity to produce evidence, as the court can, in such a case, pronounce judgment against him and does not require any additional evidence to enable it to pronounce judgment.",1
259,(Vide Haji Mohammed Ishaq v. Mohd.,1
260,Iqbal and Mohd.,0
261,Ali and Co. (1978) 2 SCC 493) .,0
262,40\.,0
263,The inadvertence of the party or his inability to understand the legal issues involved or the wrong advice of a pleader or the negligence of a pleader or that the party did not realise the importance of a document does not constitute a substantial cause within the meaning of this Rule.,0
264,"The mere fact that certain evidence is important, is not in itself a sufficient ground for admitting that evidence in appeal.",2
265,47.,0
266,"Where the additional evidence sought to be adduced removes the cloud of doubt over the case and the evidence has a direct and important bearing on the main issue in the suit and interest of justice clearly renders it imperative that it may be allowed to be permitted on record, such application may be allowed.",4
267,30\.,0
268,The order of the Commissioner dated 17.07.1973 refers to the order of the Tahsildar dated 28.07.1971 and also the report of the SDO dated 21.10.1969.,1
269,We are inclined to receive the order of Tahsildar dated 28.07.1971 as additional evidence.,1
270,"From the order of the Tahsildar dated 28.07.1971, in Civil Suit No.26A74/70-71 filed before Tahsildar, it is seen that Hanuman Din-applicant thereon filed an application before the Collector, Sidhi stating that he is the land owner-cultivator of the land numbers 131, 151, 161, 162, 163, 41 of the village Bairath and has been in possession of the lands and that the non- applicants (Vishwanath, Shiv Nath and Jairaj Kumari) got their names recorded in revenue entries in connivance with Shri Bansh Bahadur Singh, Patwari and prayed for rectification of the entries.",4
271,A report was called from the SDO who held a detailed enquiry and submitted a report.,0
272,"Based upon such enquiry and report of the SDO dated 21.10.1969, the Tahsildar held that the entry in regard to possession of the non-applicants (Vishwanath, Shiv Nath, Jairaj Kumari) in respect of land numbers 41, 131, 162, 163 was found to be made subsequently and held as under:- Indian Kanoon - http://indiankanoon.org/doc/58175470/ 10 Jagdish Prasad Patel(D) Thr.",2
273,Lrs.,0
274,"vs Shivnath on 9 April, 2019 9\.",4
275,"As far as the rectification in the Khasra entries for the years 1968-69 or prior to it is concerned, application is allowed as per para 8 and therefore, question regarding dispute in regard to subsequent years of the above years does not arise at all.",1
276,"I have personally perused the Khasra for the years 1963-64 to 1967-68 and I find that apart from the entries made in the column No.12 of the Khasra pertaining to the land No.41 at the time of inquiry, Vishwanath, Shivnath Kurmi, R/o Deh 41/1.39 it specifically appears to be made subsequently....",0
277,"Thus, it is proved that the entry in regard to the possession of non applicants Vishwanath, Shivnath and Jairaj Kumri in respect of land No.41, 151, 162 and 163 is found proved to be made subsequently.",0
278,10.,0
279,"Now, it is to be seen that who was in the possession of the disputed land prior to the disputed years.",0
280,"In this regard, none of the parties has produced any evidence.",0
281,"Hence in the interest of justice, I have called for the Khasra for the years 1961-62, 1962- 63 and gone through it and then apart from the Land No.131, non applicants are not found to be in the possession of the above land.",0
282,"In such circumstances, it is clear that Patwari Halqa with the intention to create dispute in respect of the disputed land has committed forgery before his retirement.",0
283,"Thus, the entries for the year 1963-64 to 1968-69 in relation to possession of the applicants on the land No.41, 151, 161, 162 and 163 be recorded rectified in place of the non applicants on the basis of entries for the year 1962-63 .. 31\.",3
284,The learned senior counsel appearing for the plaintiffs- respondents raised strong objections contending that the said order of the Tahsildar dated 28.07.1971 in Civil Suit No.26A74/70- 71 cannot be received as additional evidence and cannot be looked into as the said documents were not produced before the trial court nor were there reference to those documents in the written statement.,6
285,We find no merit in the contention that the order of the Tahsildar dated 28.07.1971 cannot be looked into on the ground that they were not adduced as evidence before the trial court.,5
286,"Order of the Commissioner, Rewa in Case No.52A 61/71-73 marked as Ex.",1
287,D-1 dated 17.07.1973 makes a clear reference to the order of the Tahsildar dated 28.07.1971.,1
288,"Since in Ex.D-1 (17.07.1973), there is reference to the order of the Tahsildar dated 28.07.1971, the same is received as additional evidence.",1
289,"The order of the Tahsildar dated 28.07.1971 has a direct bearing on the main issue in the suit and in the interest of justice, the same has to be received as additional evidence.",1
290,Since Ex.,0
291,"D-1 makes a reference to the order of the Tahsildar, in our view, there is no impediment in receiving the order of the Tahsildar dated 28.07.1971 as additional documents and considering the same.",1
292,"Since the order of the Tahsildar has been referred to in the order of the Commissioner dated 17.07.1973 (Ex.D-1), in our view, it will not have the effect of introducing new case necessitating remittance of the matter.",2
293,"So far as the other two additional documents namely, order of the Naib Tahsildar dated 01.09.1962 order passed in the suit filed under Section 250 of the M.P.",6
294,"Land Revenue Code and the order of the District Collector dated 21.11.1972, they are not received as additional evidence.",1
295,32\.,0
296,The order of the Commissioner dated 17.07.1973 makes a reference to the order of the Tahsildar dated 28.07.1971 which in turn refers to the suit filed by the predecessors of the plaintiffsrespondents under Section 250 of the MP Code in which plaintiffs- respondents were unsuccessful in challenging the lease in favour of Gaya Din/Hanuman Din.,7
297,This document was not produced before Indian Kanoon - http://indiankanoon.org/doc/58175470/ 11 Jagdish Prasad Patel(D) Thr.,0
298,Lrs.,0
299,"vs Shivnath on 9 April, 2019 the Courts below and now only produced as additional evidence.",4
300,"As discussed earlier, we are not inclined to receive this document as additional evidence.",0
301,"In our considered view, the first Appellate Court and the High Court fell in error in not taking into consideration the categorical findings recorded in the order of the Commissioner (Ex.",1
302,D-1) that the plaintiffs- respondents got the entries in the revenue records in connivance with the Patwari and that the Patwari was guilty of grave misconduct.,1
303,33\.,0
304,Limitation:- The respondents suit was for the reliefs of declaration of title and consequential possession of the suit lands.,0
305,The suit was instituted on 17.10.1975.,0
306,"The appellants contended that the suit is hopelessly time barred as according to them, the cause of action arose for the first time in the year 1929, when the patta was issued in favour of the appellants grandfather Gaya Din and then in the year 1935, when the Act was promulgated by the Maharaja of Rewa and then in the year 1952, when Jagirdari was abolished and Hanuman Din became the tenant of the State instead of Jagirdar and lastly on 02.11.1960, when the name of Hanuman Din was entered by the Tahsildar as bhumiswami.",5
307,"By dismissing the suit, the trial court held that the respondents/plaintiffs must have filed the suit within twelve years of possession of the defendants or dispossession of the plaintiffs.",7
308,"In the plaint, the respondents have averred that they came to know about the lease of the lands in favour of Gaya Din only in the month of August, 1969 whereas the first Appellate Court held that the suit was within the period of limitation of twelve years by treating the cause of action to have arisen on 06.11.1974 i.e.",4
309,on the date of order of the Sub- Divisional Magistrate in Section 145 proceedings.,2
310,"Since we considered the matter at length on merits, we are not inclined to go into the question of limitation.",3
311,34\.,0
312,"Case of the respondents-plaintiffs is that as per Section 5 of the Vindhya Pradesh Abolition of Jagirs and Land Reforms Act, 1952, all the Jagir Lands were resumed by the then Vindhya Pradesh Government on 23.06.1953.",4
313,"On that date, illaqedar was not authorised and was not having jurisdiction to issue patta.",0
314,"The merit of the contention is to be considered in the light of the provisions of Rewa Land Revenue and Tenancy Act, 1935 (Rewa Act) and Vindhya Pradesh Act, 1952\.",5
315,35\.,0
316,"The learned senior counsel for the appellants stated that in 1929, there was no codified revenue law in the State of Rewa.",4
317,"In 1935, Maharaja of Rewa promulgated the Rewa Land Revenue and Tenancy Act, 1935.",2
318,"Section 2 of the Rewa Act repealed all earlier government notices, rules, circulars, orders, notifications etc.",4
319,that are inconsistent to the said Act; but saved the action taken thereunder.,0
320,"Thus, the action taken thereunder the said Act like grant of patta etc.",1
321,was saved.,0
322,"Case of the appellants- defendants is that by virtue of Section 2 of the Rewa Act, grant of patta to Gaya Din is saved.",4
323,It is also their case that Section 3 of the Rewa Act saved the existing proceedings and the fathers of the respondents could have proceeded against the appellants under Sections 46 and 142 of the Rewa Act.,6
324,"However, they have not initiated any proceedings under the said provisions of the Act.",2
325,"In 1948, the State of Rewa acceded to India and became part of the State of Vindhya Pradesh.",1
326,"In 1952, the State of Vindhya Pradesh abolished the system of Jagirdari by the Vindhya Pradesh Abolition of Jagirs and Land Reforms Act, 1952.",3
327,"Under Section 26 of the Vindhya Pradesh Act, the appellants father Hanuman Din became direct tenant of the State in place of Jagirdar and under Section 28 of the Act, he became a pattedar- tenant.",5
328,Indian Kanoon - http://indiankanoon.org/doc/58175470/ 12 Jagdish Prasad Patel(D) Thr.,0
329,Lrs.,0
330,"vs Shivnath on 9 April, 2019 36\.",4
331,"By the States Reorganization Act, 1956, the erstwhile State of Vindhya Pradesh became a part of larger Madhya Pradesh.",1
332,"Subsequent to which, the State of Madhya Pradesh enacted the M.P.",1
333,"Land Revenue Code, 1959 (M.P.",2
334,"Code) whereby the appellants predecessor Hanuman Din being a pattedar-tenant in Vindhya Pradesh in possession of the lands, became their Bhumiswami under Section 158(1)(d)(i) of the M.P.",3
335,Code.,0
336,After following the due procedure laid down under Sections 109 and 110 of the M.P.,2
337,"Code, his name was entered in revenue records.",0
338,37\.,0
339,The trial court rightly held that the disputed lands belonged to the iIlaqa and the Pawaidar was empowered under the provisions of Section 44 of the Rewa Act to issue the said lease (Ex.,7
340,D-20).,0
341,"Section 44 of the Rewa Land Revenue and Tenancy Act, 1935 reads as under:44.",4
342,"Conferment of Pattas (1) In a kothar village, the following revenue officers are authorised to confer a patta:.",0
343,"(2) In a pawai, the following persons may confer a patta:(a) at a revision of settlement the Settlement Officer and Assistant Settlement Officers, (b) during the currency of Settlement A pawaidar in pawai land not included in a sub-pawai; A sub-pawaidar in respect of land included in his sub- pawai; A mortgagee in possession; A mortgagor in possession; The Court of Wards in land under its superintendence; A widow having life interest in a pawai or sub-pawai; .. 38\.",2
344,"The learned senior counsel for the respondents-plaintiffs submitted that upon consideration of the evidence of Hanuman Din (DW-1), the first appellate court recorded a finding of fact that in the year 1954, patta was granted in favour of Gaya Din (defendants father) and as per the testimony of Hanuman Din (DW-1), when patta was issued, Hanuman Din was 35 years old.",6
345,"It was submitted that based on the evidence of Hanuman Din, the first appellate court recorded finding that patta was granted in favour of Gaya Din in the year 1954 by which time, the tradition of Pawai has been removed and therefore, patta granted in favour of Gaya Din is not a valid one.",4
346,"The first appellate court arrived at such a finding without proper facts and by drawing an inference noting that when DW-1 was examined in 1984, he was aged 65 years from which the first Appellate Court inferred that Indian Kanoon - http://indiankanoon.org/doc/58175470/ 13 Jagdish Prasad Patel(D) Thr.",2
347,Lrs.,0
348,"vs Shivnath on 9 April, 2019 DW-1 must have been born in 1919.",6
349,"Referring to the statement of DW-1 that when patta was issued, he was aged 35 years, the first appellate court inferred that patta must have been issued in 1954 (DW-1 born in 1919 + 35=1954) and by that time, system of Pawai had been removed.",5
350,"In this regard, the learned senior counsel for the respondents-plaintiffs submitted that as per Section 5 of the Vindhya Pradesh Act, all the Jagir Lands were resumed in the then Vindhya Pradesh Government on 23.06.1953, hence, on this date, Pawaidar/iIlaqedar/Jagirdar were not authorised and were not having jurisdiction to issue patta and therefore, the finding of the first appellate court that the patta issued in the name of Gaya Din in the year 1954 is not a valid one and the said findings of fact cannot be interfered with.",9
351,39\.,0
352,The finding of the first appellate court that the patta was granted to Gaya Din in 1954 and that illaqedar was not competent to issue patta is misconceived.,3
353,"As discussed earlier, patta was granted to Gaya Din not in 1954 but in Samvat 1986 (1929 A.D.) when admittedly the illaqedar had such power.",4
354,"That apart, the validity of patta so granted cannot be determined based on the inference drawn as to the age of DW-1-Hanuman Din.",0
355,"The learned senior counsel appearing for the appellants has drawn our attention to the provisions of Vindhya Pradesh Act and submitted that as per Section 5 of the said Act, the State Government by a notification appointed a date for the resumption of any class of Jagir Lands and the consequences of such resumption are set out in Section 6 of the said Act.",7
356,"We find substance in the submission of the learned senior counsel for the appellants that in terms of Section 28 of the said Act, the appellants who were till then the tenants of intermediary/Jagirdar shall be deemed to be pattedar tenant in respect of the said lands.",5
357,"Section 28 of the Vindhya Pradesh Abolition of Jagirs and Land Reforms Act, 1952 reads as under:28.",4
358,Certain occupants of lands to be pattedar tenants.,0
359,"(1) Subject to the provisions of sub-section (2) every person who is entered in the revenue record for a continuous period of three years as an occupant of any Jagir-land at the date of resumption, shall be deemed to be pattedar tenant in respect of such land which shall be assessed at the village rate.",4
360,(2) Nothing in sub- section (1) shall apply to any sir or khudkasht land which is allotted to the Jagirdar under Section 22 or any grove land possession of which the Jagirdar is entitled to retain under clause (c) of Section 7.,3
361,"In view of the provisions of the above Act, the first appellate court erred in saying that the patta in favour of Gaya Din was granted in the year 1954 and by that time, Pawaidar/iIlaqedar was not having jurisdiction to issue patta.",4
362,40\.,0
363,"Re: Finding of the first appellate court: Ownership of the respondents not terminated in a legal way:- The first appellate court held that the ownership of Rameshwar and Ram Sahai was not terminated in a legal way and therefore, they are to be treated as owners of the suit properties.",2
364,"The first Appellate Court further held that since the ownership of Rameshwar and Ram Sahai was not terminated in a legal way, the lease deed- Ex.D-20 which has been produced on behalf of defendant No.1 cannot be treated to be a proved document and on those findings, set aside the finding of the trial court that defendant No.1 is having a legal right of ownership of the disputed lands.",6
