1,Lrs.,0
2,"vs Shivnath on 9 April, 2019 Supreme Court of India Jagdish Prasad Patel(D) Thr.",5
3,Lrs.,0
4,"vs Shivnath on 9 April, 2019 Author: R Banumathi REPORTABLE IN THE SUPREME COURT OF INDIA CIVIL APPELLATE JURISDICTION CIVIL APPEAL NO.2176 OF 2007 JAGDISH PRASAD PATEL (DEAD) THR.",8
5,"LRS.& ANOTHER Appellants VERSUS SHIVNATH & OTHERS Respondents JUDGMENT R. BANUMATHI, J.",2
6,"This appeal arises out of the judgment dated 05.02.2007 passed by the High Court of Madhya Pradesh at Jabalpur dismissing the Second Appeal No.174 of 1989 filed by the appellants, thereby affirming the decision of the first Appellate Court in Civil Appeal No.29-A/85 holding that in the absence of any order of abandonment or revocation of the patta given to the forefathers of the respondents-plaintiffs, grant of patta in favour of the appellants/defendants was illegal and that the appellants- defendants cannot claim any right over the suit properties.",11
7,Signature Not Verified 2\.,0
8,"Case of Respondents-plaintiffs is as under:- Digitally signed by MAHABIR SINGH Respondents-Shiv Nath and deceased Vishwanath/predecessor in Date: 2019.04.09 17:37:26 IST Reason: interest of respondents No.2 to 10 filed a suit for declaration of title over the suit lands in khasra numbers 41-1.39, 131-2.70, 162-0.17, 163-3.92 and 164-2.15 Kita 5 total area 10.33 situated in Village Bairath General No.782, Tehsil Gopad Banas and possession of all the khasra numbers except khasra No.164 against the father of the appellants- Hanuman Din.",3
9,Ram Sahai and Rameshwar fathers of the plaintiffs were the joint lessees of the lands in khasra Nos.,1
10,"41, 131, 132, 136/13, 135, 134/4, 137/27, 140/11, 142/2, 143, 146, 147, 162, 163/25, 164/4 and 257 total measuring 21.45 acres and their names were included as lessees of the above lands during the settlement and they kept on cultivating the lands till forty years back when a partition took place between the two and both of them became owners of half part each.",0
11,Hanuman Din never remained in possession of any part of the lands nor he had any right or entitlement over the suit lands; but the grandfather of the appellants-Gaya Din got a lease in disputed lands of the respondents which according to the respondents is a forged document.,0
12,"Based on the aforesaid lease, Gaya Din got his name entered as khatedar in respect of the khataunis of the disputed lands.",0
13,3\.,0
14,"Respondent-deceased Vishwanath- predecessor-in-interest of respondents No.2 to 10 filed an application before the Collector in August, 1969 stating that the lease of the disputed lands was Indian Kanoon - http://indiankanoon.org/doc/58175470/ 1 Jagdish Prasad Patel(D) Thr.",4
15,Lrs.,0
16,"vs Shivnath on 9 April, 2019 wrongly issued by illaqedar in the name of Gaya Din and the proceedings for cancellation of the records in the name of Gaya Din be initiated.",4
17,The matter was sent to the Revenue Inspector for enquiry who submitted his report in favour of respondents in respect of the ownership of the lands in dispute and the Collector registered the report after approving it.,0
18,In proceedings before the Sub-Divisional Magistrate in Miscellaneous Case No.351/142/69 under Section 145 Cr.P.C.,4
19,"initiated by Hanuman Din, the Sub-Divisional Magistrate found Hanuman Din in possession of lands in khasra Nos.162 and 163 and respondents were found in possession of land in khasra No.164.",0
20,"Respondents-plaintiffs alleged that pursuant to the order of the Sub-Divisional Magistrate, Hanuman Din forcibly took possession of land in khasra No.41 and therefore, the respondents filed suit for declaration and permanent injunction.",1
21,4\.,0
22,"Hanuman Din resisted the suit contending that the respondents have never remained in ownership or possession of the disputed lands and the lands belonged to one Ram Raj Singh but he was not cultivating the lands and gave it to the predecessors of the respondents for cultivation on the basis of Batai-crop sharing and only because of this, patta was granted at the time of settlement in their names.",3
23,"The appellants further averred that the father of the respondents abandoned the lands and since revenue tax was not being paid, the khata of the disputed lands was cancelled.",0
24,"Case of the appellants-defendants is that in the auction held by Pawaidar for lease of suit lands and other lands, bid of Gaya Din was accepted and in this regard, a lease was issued in his name in Samvat 1986 (1929 A.D.).",4
25,The appellants had been in continuous possession of the suit properties and the same is reflected in the khataunis and other revenue records.,0
26,5\.,0
27,"The trial court vide judgment dated 02.07.1985 dismissed the respondents suit by holding that Gaya Din has been holding patta- lease (Ex.D-20) in respect of the suit lands and has been in continuous possession of the disputed lands since 1950 and thereafter, Hanuman Din was in possession of the same.",6
28,"After referring to the orders of the Commissioner (Ex.D-1), the trial court held that the Commissioner recorded a finding of fact that the respondents got the entries made in the revenue records in their names in connivance with the Patwari.",6
29,The trial court held that the lease-patta (Ex.D-20) was issued by the then iIlaqedar to Gaya Din and that the said document being more than thirty years old is a genuine one.,5
30,"After referring to various khasras and the entries thereon in the name of appellants father, it was held that the appellants father Hanuman Din has been in possession of the suit lands since 1950 or prior to that.",4
31,The trial court further held that the suit was instituted on 17.10.1975 which is beyond twelve years and that the suit is barred by time.,3
32,6\.,0
33,"In appeal, the first Appellate Court vide its judgment dated 03.04.1989 held that at the time of settlement, patta was granted in the name of father of the respondents and this has not been disputed by the appellants and the appellants could not establish abandonment of the lands by the father of the respondents and therefore, the respondents ought to be treated as owners of the suit properties.",2
34,"The first Appellate Court further held that the lease Ex.D-20 produced by the appellants cannot be held to be a valid one and in absence of order of revocation of the patta granted to the respondents, it cannot be held that Ex.D-20 confers right of ownership on the appellants over the disputed lands.",1
35,"The first Appellate Court held that merely because of production of patta- lease Ex.D-20 by Hanuman Din, it cannot be said to have been proved and therefore, it cannot be held that Hanuman Din has a legal right of ownership on the disputed lands.",1
36,The first Appellate Court Indian Kanoon - http://indiankanoon.org/doc/58175470/ 2 Jagdish Prasad Patel(D) Thr.,0
37,Lrs.,0
38,"vs Shivnath on 9 April, 2019 noted that on the basis of Ex.D-1 order of the Commissioner, possession of the suit properties by the appellants cannot be held to be proved, since the respondents or their ancestors were not parties to the said proceedings.",7
39,"On these findings, the first Appellate Court set aside the judgment of the trial court and held that the respondents are the owners of the disputed lands and held that the respondents are entitled to get possession of the lands in khasra Nos.",5
40,"41, 131, 162 and 163 from the father of the appellants.",0
41,7\.,0
42,"In the second appeal, the High Court affirmed the findings of the first Appellate Court and held that the suit lands were recorded in the name of fathers of the respondents and that there was no document on record to show that they have abandoned the possession of the lands or surrendered the same in favour of iIlaqedar.",1
43,"It was held that though patta-lease Ex.D-20 was granted in favour of grandfather of the appellants, the appellants have not adduced any evidence to prove abandonment of the lands in favour of iIlaqedar and no right accrued to the appellants on the basis of the patta (Ex.D-20).",6
44,"Being aggrieved, the appellants have preferred this appeal.",1
45,8\.,0
46,"We have heard Mr. Subodh Markandeya, learned senior counsel for the appellants-defendants and Mr. A.K.",1
47,"Shrivastava, learned senior counsel for the respondents-plaintiffs.",1
48,We have considered the submissions and carefully perused the impugned judgment and the judgment of the courts below and other materials on record.,1
49,9\.,0
50,"The point falling for consideration is whether the High Court was right in upholding the judgment of the first Appellate Court by observing that in the absence of any order of abandonment or revocation of the patta given to the respondents- plaintiffs, grant of patta (Ex.D-20) in 1929 in favour of the appellants- defendants was illegal and that the appellants-defendants cannot claim right based upon Ex.D-20 and other documents.",3
51,10\.,0
52,The impugned judgment of the High Court is the concurrent finding of the High Court and the first Appellate Court.,1
53,"We are conscious that in an appeal under Article 136 of the Constitution of India, the concurrent findings cannot be interfered with unless warranted by compelling reasons.",3
54,"When the finding of the first Appellate court and the High Court are shown to be perverse, this Court would certainly interfere with the findings of fact recorded by the High Court.",3
55,[Vide Mahesh Dattatray Thirthkar v. State of Maharashtra (2009) 11 SCC 141] 11\.,2
56,"The respondents-plaintiffsShiv Nath and deceased Vishwanath filed suit for declaration of title over the suit lands in khasra numbers 41-1.39, 131-2.70, 162-0.17, 163-3.92 and 164-2.15 total area 10.33 situated in Village Bairath General No.782, Tehsil Gopad Banas on the plea that a lease/patta was issued in favour of their fathers and that their names were included as lessees of the suit lands during settlement and that they have been cultivating the lands till forty years back when partition took place between the two and both Shiv Nath and deceased Vishwanath became owners of half portion each.",2
57,12\.,0
58,The appellants-defendants resisted the suit contending that Ram Raj Singh was the original owner of the lands but he was not cultivating the lands and settlement patta was given in the name of the fathers of respondents namely Ram Sahai and Rameshwar on the basis of Batai-crop sharing Indian Kanoon - http://indiankanoon.org/doc/58175470/ 3 Jagdish Prasad Patel(D) Thr.,3
59,Lrs.,0
60,"vs Shivnath on 9 April, 2019 at the time of settlement and the predecessors of respondents-plaintiffs have not cultivated the lands.",4
61,"The appellants-defendants further averred that the forefathers of respondents- plaintiffs abandoned the suit lands and since revenue tax was not paid, the lease of the suit lands in favour of respondents-plaintiffs was cancelled.",0
62,The then illaqedar accepted the bid of the defendants father Gaya Din in the auction held in the year 1929-Samvat 1986.,4
63,The appellants-defendants have claimed ownership and possession over the lands in dispute on the basis of the patta Ex.D-20 (Ex.,3
64,P21) that was issued in their favour in Samvat 1986 (1929 A.D.) and averred that since then they are in possession of the disputed lands.,3
65,13\.,0
66,The suit of the respondents-plaintiffs is for declaration of their title to the suit lands and consequential delivery of the suit lands.,1
67,"Having filed the suit for declaration of title, the plaintiffs could succeed in their suit only by adducing sufficient evidence to establish their title.",3
68,But the plaintiffs have not produced the patta granted to their fathers.,1
69,"PW-1-Vishwanath, in his deposition, stated that the original patta was very old, torn and the same is not with them.",3
70,The respondents-plaintiffs have produced the report of the Revenue Inspector dated 05.10.1969 (Ex.,1
71,"P-3) as per which on the application of Vishwanath, an enquiry was made and it was found that the name of pattedar is Gaya Din.",0
72,Gaya Din and Shiv Nath are shown as lease holders.,0
73,"In Ex.P-3, it is further stated that in Khatauni No.58/59, it was found that names of Ram Sahai and Rameshwar Kurmi are found recorded as owners of land numbers 51/1.38, 162/0.17, 163/3.72, 164/2.65 and 131/2.70.",2
74,It was further stated that the patta illaqa of the above numbers are found registered in the name of Gaya Din.,3
75,Ex.P-3-report notes the entries in Ex.D-20-patta to the effect that permission to make entry in respect of the patta granted vide order No.146/1960 dated 21.11.1960 issued by the Tahsildar in the official record has been given after due inspection and entry in khasra is found made by the concerned Patwari on 10.01.1961.,1
76,14\.,0
77,"In his evidence, PW-1 has stated that patta-lease was issued in the name of his father.",3
78,"In his written statement, defendant Hanuman Din also admitted that the plaintiffs- respondents fathers were lessees and patta-lease was originally granted in their favour during the settlement period for cultivation on the basis of Batai-crop sharing.",5
79,The trial court as well as the first appellate court held that the lease was granted in favour of father of respondents-plaintiffs at time of the settlement and they were held to be original lessees.,3
80,"The trial court while deciding issue No.2(A), observed that the grant of lease in the name of father of respondents-plaintiffs in the settlement is not rebutted by the appellants-defendants.",3
81,"Drawing our attention to the findings of the trial court that patta was granted in favour of the father of the respondents- plaintiffs, the learned senior counsel for the respondents-plaintiffs submitted that this amounts to admission and in terms of Section 58 of the Evidence Act, admitted facts need not be proved.",6
82,"Placing reliance upon Nagindas Ramdas v. Dalpatram Iccharam alias Brijram and others (1974) 1 SCC 242 and Executive Officer, Arulmigu Chokkanatha Swamy Koil Trust, Virudhunagar v. Chandran and others (2017) 3 SCC 702, it was submitted that in view of clear admission of grant of lease in the name of father of respondents- plaintiffs, the said admitted fact need not be proved.",2
83,15\.,0
84,"Section 58 of the Evidence Act, no doubt, postulates that the things admitted need not be proved.",2
85,"However, proviso to Section 58 of the Evidence Act gives full discretion to the court to require the Indian Kanoon - http://indiankanoon.org/doc/58175470/ 4 Jagdish Prasad Patel(D) Thr.",3
86,Lrs.,0
87,"vs Shivnath on 9 April, 2019 facts admitted to be proved otherwise than by such admission.",4
88,"When the respondents-plaintiffs have filed the suit for declaration of their title, the respondents-plaintiffs cannot isolate few sentences in the written statement and take advantage of only those part of the written statement which are favourable to them.",1
89,The written statement filed by the appellants-defendants has to be read in toto.,1
90,It is pertinent to note that in para No.,1
91,"(2) of the written statement, the appellants-defendants averred that the lands were in the ownership of Ram Raj Singh at the time of the settlement, but because he was not in a position to cultivate the same himself, the lands were given to the father of the respondents-plaintiffs for cultivation on the basis of Batai-crop sharing.",3
92,It is further averred that the then Halkedar cancelled the lease in respect of disputed lands and the same were auctioned in which the bid of the defendants father Gaya Din was accepted and the disputed lands were transferred in his name in the sale in Samvat 1986 i.e.,3
93,1929 A.D.,2
94,The lease of the lands was issued in the name of Gaya Din.,1
95,The admission of the defendants as to the lease of the plaintiffs father was the lease earlier granted in favour of the forefathers of the respondents.,2
96,"In the light of the pleadings and the oral and documentary evidence adduced by the defendants, notwithstanding the admission in the written statement, the burden lies upon the respondents-plaintiffs to prove that the patta-lease continues to be in their favour and that they are the holders of patta and that they are in continued possession of the suit properties.",0
97,16\.,0
98,"In his cross-examination, PW-1 stated that his father left for Jabalpur about forty years prior to the institution of the suit.",2
99,"In the cross-examination, PW-1 however denied the suggestion that when his father left for Jabalpur, he handed over the disputed lands to Pawaidar and all the records at the relevant time were kept by the iIlaqedar.",0
100,"From the statement of PW-1-Vishwanath and PW-2-Ram Gopal, it is evident that the father of Vishwanath had started living in Jabalpur forty years back prior to institution of the suit and settled there.",0
101,"In the light of the evidence adduced, the trial court rightly accepted the case of the defendants that in Samvat 1986 (1929 A.D.), in the auction held by Pawaidar for lease of suit lands and other lands, bid of Gaya Din was accepted and the suit properties along with other lands were given on lease to Gaya Din.",6
102,"We find substance in the submission of the learned senior counsel for the appellants that if the lands were not left so abandoned by the father of respondents-plaintiffs, it would not have been possible for the Pawaidar to auction the lease of the suit lands and grant lease of the lands in favour of Gaya Din.",1
103,17\.,0
104,"Case of the appellants-defendants that in Samvat 1986 (1929 A.D.), in the auction held by Pawaidar for lease of suit lands and other lands, the suit properties along with other lands were given on lease to Gaya Din, is strengthened by revenue records and ample evidence.",3
105,The Pawaidar sanctioned entries regarding grant of patta to Gaya Din to be made in the Government records.,1
106,The appellants-defendants produced their patta-Ex.,0
107,D-20 which has also been produced by the respondents-plaintiffs (Ex.,0
108,P-21).,0
109,Ex.,0
110,"D-20 is the patta kashtkari as per the order of the Honble Shri Rai Saheb Churhat, Halka Patwari No.1, Region Churhat, State Rewa, Location Mauja Kother, in Samvat 1986 in the name of Gaya Din as farmer/cultivator for the suit properties granted for agricultural purpose.",4
111,From Ex.,0
112,"D-20, it is seen that as per Tahsildar order No.146/1960 dated 21.11.1960, Pawaidar has been allowed to enter in government serial.",3
113,"As per the order of the Tahsildar, entry has been made accordingly in Pawai Khasra as is clear from the endorsement made by Patwari dated 10.01.1961 in Ex.D-20.",2
114,Indian Kanoon - http://indiankanoon.org/doc/58175470/ 5 Jagdish Prasad Patel(D) Thr.,0
115,Lrs.,0
116,"vs Shivnath on 9 April, 2019 18\.",4
117,Ex.,0
118,D-20-patta in favour of Gaya Din was validly granted by the iIIaqedar to Gaya Din in the year 1929\.,1
119,The said documents issued by the Tahsildar were produced from the custody of the appellants.,0
120,"The contents thereon show that as per the Government records, the lands had been given to Gaya Din.",1
121,"The documents being more than thirty years old, the trial court rightly presumed the Ex.D-20-patta of genuine.",2
122,It was then up to the respondents to rebut the presumption.,0
123,This has not been controverted by the respondents-plaintiffs.,0
124,19\.,0
125,Ex.,0
126,D-20 being thirty year old document gives rise to presumption as to its genuineness.,0
127,Contention of the respondents-plaintiffs is that Section 90 of the Evidence Act has no application to Ex.,4
128,D-20 and the presumption cannot be raised as to the genuineness of the contents of the document.,0
129,Section 90 of the Evidence Act enables the court to draw presumption about the genuineness of the document which is thirty years old.,3
130,Section 90 lays down that the court may presume that the document is genuine.,3
131,"Since the patta granted in favour of Gaya Din is of Samvat 1986 (1929 A.D.) which is more than thirty years old, Section 90 raises presumption as to the authenticity of the document.",4
132,Mere allegations of fraud would not be sufficient to rebut the presumption raised under Section 90 of the Evidence Act.,4
133,20\.,0
134,The respondents-plaintiffs have produced the copies of khasras of several years.,0
135,"However, only the copies of khasra for the years 1955-56 (Ex.",0
136,P-9) and 1956-57 (Ex.,0
137,P-10) are in the name of respondents- plaintiffs; and in the previous khasras for the years 1950-51 to 1954-55 (Ex.,0
138,P-8) and subsequent khasras for 1960-61 (Ex.,0
139,"P-12), 1963-64 to 1965-66 (Ex.",0
140,"P-13), 1968-69 (Ex.",0
141,P-14) and 1970-71 to 1975 (Ex.,2
142,"D-2), the entries are in the name of the father of the appellants-defendants.",0
143,The lease was granted in favour of Gaya Din and that he and Hanuman Din had been continuously in possession of the properties is thus established by the revenue records.,0
144,21\.,0
145,"From perusal of the Khatauni for the year 1952-53 (Ex.P-2) produced by the plaintiffs, it is seen that the appellants- defendants are in possession of the suit lands from the year 1950-51 to 1954-55 (Ex.",2
146,"P-8) and thereafter, the subsequent khasras 1960-61 onwards.",0
147,The names of the appellantsdefendants being mentioned in the khasra 1950-51 to 1954-55 is very crucial.,0
148,"The reason being Vindhya Pradesh Abolition of Jagirs and Land Reforms Act, 1952 (Vindhya Pradesh Act) came into force on 30.07.1953.",2
149,Ex.,0
150,D-20 (Ex.,0
151,"P-21) - lease was granted in favour of the predecessors of the appellants- defendants namely Gaya Din by Pawaidar under Section 44 of the Rewa State Malgujari and Kashtkari Act, 1935 (Rewa Land Revenue and Tenancy Act, 1935).",7
152,After referring to Ex.,0
153,"D-20, the trial court rightly held that the Pawaidar was empowered to issue the lease and that lease (Ex.",3
154,D-20) was issued under Section 141 of the Act.,5
155,It was therefore rightly held by the trial court that the lease (Ex.,2
156,D-20) is valid and that the appellants- defendants have proved that the lease of the lands was legally given by illaqedar in favour of their father.,1
157,22\.,0
158,The revenue records produced by the appellants for several years amply strengthen the case of the appellants that patta (Ex.,1
159,D-20) was granted to them and that they are in possession of the suit properties for several years.,0
160,"The oral and documentary evidence clearly establish that the father of the respondents- plaintiffs has abandoned the suit properties, pursuant to which, auction was held by the Pawaidar and lease was issued by illaqedar in favour of Gaya Din and that he was in continuous possession of the suit properties.",1
161,Indian Kanoon - http://indiankanoon.org/doc/58175470/ 6 Jagdish Prasad Patel(D) Thr.,0
162,Lrs.,0
163,"vs Shivnath on 9 April, 2019 23\.",4
164,"In the plaint, the respondents/plaintiffs have alleged that Ex.",0
165,D-20-patta is a forged one.,0
166,In para No.,1
167,"(4) of the plaint, it is alleged that without knowledge of the respondents/plaintiffs father, defendants father Gaya Din got the lease from Ilaqa Churhat by illegal means and Gaya Din never remained in possession of the properties.",1
168,The respondents-plaintiffs have not produced any document to prove that Ex.,0
169,D-20 is a forged one.,0
170,"The plaintiffs at one place averred that without the knowledge of the plaintiffs and their father, Gaya Din succeeded in getting the lease by illegal means of the disputed lands from iIlaqa therein; whereas in para No.",3
171,"(5), the respondents-plaintiffs alleged that the document is a forged one.",0
172,"In fact, as pointed out earlier, the respondents themselves have filed the patta granted in favour of the appellants- defendants.",2
173,"It is pertinent to note that Vishwanath had given an application for inspection of the area (patta) in respect of land numbers 41, 131, 162, 163 and 164 situated in Village Bairath.",0
174,The Collector called for the report from the Revenue Inspector and as per the Report of the Revenue Inspector (Ex.,0
175,"P-3), though the names of Ram Sahai and Rameshwar are found recorded as owners of the said lands, patta illaqa of the above land numbers was found registered in the name of Gaya Din.",0
176,The report of the Revenue Inspector refers to the entry in respect of patta granted vide order No.146/1960 dated 21.11.1960 issued by the Tahsildar.,1
177,It also refers to entry in khasra made by the concerned Patwari on 10.01.1961 which is in possession of Hanuman Din- predecessor of the appellants.,0
178,Ex.,0
179,P-3-Report of Revenue Inspector states that the patta-Ex.,0
180,D-20 was granted in favour of Gaya Din.,0
181,24\.,0
182,The entries which are consistently in favour of the appellants ought not to have been ignored in preference to the entries in favour of the respondents only for two years i.e.,0
183,1955- 56 and 1956-57.,0
184,"Moreover, in the light of the findings by the revenue authorities on several occasions, the said entries in the name of the respondents cannot be said to be genuine.",0
185,The first Appellate Court and the High Court were not right in brushing aside Ex.,1
186,P-21 (Ex.D-20) patta granted in the name of the appellants and other crucial documents like report of the Revenue Inspector (Ex.,0
187,P-3) which notes that patta illaqa is in the name of Gaya Din and the several entries in the revenue records are in the name of the appellants.,0
